headline,short_description,category
97 Percent Of DC's Prisoners In One Type Of Solitary Confinement Are Black,"Corrections officials say prolonged isolation is a ""grave"" problem and they seek to limit or end it.",POLITICS
"Despite Rising Rates Of Depression, It's Doubtful We'll See New Drugs",Pharmaceutical companies aren't investing in antidepressants research because the risks are too high.,HEALTHY LIVING
5 Tips for Stress-Free Holiday Style,"During the holidays, it's all about parties and get-togethers with friends and family. With all of these events on the horizon, it can be a daunting task to get the right looks.",STYLE & BEAUTY
Net Neutrality Supporters At NYC Verizon Store: 'We Cannot Let Them Have The Net',"“Net neutrality equals democracy,"" said one protester.",POLITICS
"Actor R. Lee Ermey, Who Played Foul-Mouthed Drill Sergeant In 'Full Metal Jacket,' Dead At 74",He was nominated for a Golden Globe as Best Supporting Actor for the role.,ENTERTAINMENT
Jane Krakowski Supports 'Boating Lights' At ACLU Event,"Nah, not voting rights. Boating lights.",ENTERTAINMENT
Paris: Traveling The World Through Instagram,Paris at Sunset Moulin Rouge Montmartre Also follow Laurent Buanec for beautiful Paris buildings under blue skies. Notre,TRAVEL
Empathy Helps Where Sympathy and Tough Love Fall Short,"All the craziness I'd set aside came rushing back -- fear of my own incompetence, suffocating guilt, terrified disbelief -- thinking of the weeks, months and years of monotonous chaos I was in for. Meanwhile, I couldn't imagine getting through even one day.",WELLNESS
Trump's Logic Regarding Confederate Monuments Is Dangerous And Dunderheaded,The president is advocating rosy memorials for former enemies of the state.,POLITICS
We Finally Know Why The Scavengers Speak So Strangely On 'Walking Dead',Executive Producer David Alpert clears things up.,ENTERTAINMENT
The Right to Life (Last Chapter),"People are just living life to death. They are living it up, as it were. The health care system is tanking from keeping a",HEALTHY LIVING
John Legend Upgrades 'Downton Abbey' Theme Song With Honest Lyrics,"""Everyone we know is very white. We don't have one black friend.""",ENTERTAINMENT
Paul Ryan Tries To Act Cool In White House Correspondents' Dinner Video,Retirement -- and boredom -- seem to be weighing heavily on the House speaker.,POLITICS
Christie Brinkley Shows Us How To Ace September Dressing (PHOTOS),"Want more? Be sure to check out HuffPost Style on Twitter, Facebook, Tumblr, Pinterest and Instagram at @HuffPostStyle. The",STYLE & BEAUTY
"Kasich Wouldn't Cancel Iran Deal, Would Send Troops To Fight ISIS","Unlike some of his Republican rivals, the Ohio governor suggested that he wouldn't immediately rip up Obama’s agreement with Iran if elected president.",POLITICS
Academy President Defends 'The Birth Of A Nation' Amid Rape Backlash Without Having Seen It,"“That’s one issue, that’s his personal issue.""",ENTERTAINMENT
Elizabeth Warren Calls Out Senate Republicans' Hypocrisy On Trump,Republicans are criticizing Donald Trump while keeping a Supreme Court seat open in hopes he'll become president.,POLITICS
What The World’s Healthiest Diets Have In Common,It's not what you'd think.,WELLNESS
Carly Fiorina Hopes To Turn Debate Momentum Into Votes And Cash,It's a quest that will determine whether her breakthrough moment is a turning point in the Republican primary or simply a footnote.,POLITICS
Biden Administration To Suspend Trump-Era Oil Leases In Arctic Refuge,"Biden had vowed during the campaign to “reverse the Trump administration’s assaults on America’s natural treasures,"" including the Alaska refuge.",POLITICS
Here's A Gross Old Clip Of Billy Bush Asking Jennifer Lopez About Her Butt,"""You did not just ask me that.""",ENTERTAINMENT
Lewandowski Says 'Of Course' He Steamed Trump's Pants While President Wore Them,"""If that’s part of my job as a campaign manager, I do it all.”",POLITICS
Donald Trump Slams Hillary Clinton's 'Sad' Recount In Series Of Tweets,"""So much time and money will be spent - same result! Sad,"" Trump tweeted early Sunday morning.",POLITICS
Exercise During Leisure Time Could Lower Risk Of High Blood Pressure,"The study, conducted by researchers at the Shandong University School of Public Health in China, looked at data from 13 past",WELLNESS
Trump Administration To Expand Groups Of Immigrants To Be Deported: Report,One document suggests anyone in the U.S. illegally is to be considered subject to deportation.,POLITICS
Kelly Brook Sheds Her Playboy Image In A Demure Look (PHOTO),PacificCoastNews WHAT: The British stunner was all smiles in a highwaisted skirt as she walked around north London. The former,ENTERTAINMENT
What You Need To Know Before Watching 'The Defenders' On Netflix,There's a lot to catch up on.,ENTERTAINMENT
Tory Burch For InStyle: New Column Brings Magazine Into Luxury Market,"Tory Burch has been tapped by InStyle to write their ""Ask a designer"" column, Women's Wear Daily reports. Burch will be taking",STYLE & BEAUTY
Cheerleaders Entertain Stranded Passengers At China's Dalian International Airport,"The airport brought in a group of college cheerleaders to perk up passengers, reports ChinaSmack. Sporting matching blue",ENTERTAINMENT
129 Million Reasons Republicans Failed On Health Care,"Before the Heritage Foundation health care plan, first passed into law as “Romneycare” in Massachusetts, and then as the",HEALTH
Khloe Kardashian Channels Priscilla Presley In Insta Pic,nan,ENTERTAINMENT
5 Secret Weapons We Use To Score Cheap Plane Tickets,"When you're booking a trip with a foreign carrier, try booking your ticket in the local currency instead of U.S. dollars.",TRAVEL
Trump Officially Declares Opioid Crisis An Emergency 2 Months After Saying He Would,The president's declaration of a public health emergency falls short of previous indications that he'd declare a national emergency.,HEALTH
"Happy Birthday, ADA!","Expectant mothers risk losing their jobs, their babies or both when employers deny them pregnancy accommodations at work.",PARENTING
Regrets and Your Health,When we let go of regrets we open up space within our being. This space then has the opportunity to bring creative endeavors into our lives. The present moment becomes realized as we release ourselves from the chains of the past.,WELLNESS
How to Get Shoulders Like Ryan Lochte's,"With the Olympics just around the corner, many of us can't wait to witness the triangular, perfectly-defined bodies of swimmers like Michael Phelps and Missy Franklin. But if you don't swim 10,000 meters a day, can you still get Phelps' and Franklin's toned shoulders? Absolutely!",WELLNESS
This 15-Minute Workout Can Make You Faster And Stronger,nan,HEALTHY LIVING
How To Turn Yourself Into A Muppet,Add a fun twist to your kids' playtime by creating your own hilarious muppet character (inspired by the classic characters,ENTERTAINMENT
Nebraska Senator Uses Gore Porn To Argue For Restoring Death Penalty,nan,POLITICS
The Long Term Is Getting Shorter,nan,WELLNESS
So What If Our Child Has 87 Siblings?,"As long as in the end I was a mother, nothing was a game-changer for me. Until a few months back when I saw PBS's ""Donor Unknown.""",PARENTING
Sarah Jessica Parker At Louis Vuitton: Look Of The Day (PHOTOS),"WHO: Star of the upcoming film ""Lovelace"" Sarah Jessica Parker Shop the look below and check out more of our Look Of The",STYLE & BEAUTY
Hanneli Mustaparta Makes Monochromatic Look Easy,WHERE: ACNE Studios New York flagship store opening dinner on June 5th. David X Prutting/BFAnyc.com Shop a similar look below,STYLE & BEAUTY
"Veteran Federal Judge Blasts Ruling That Will Disenfranchise Poor, Black Ohio Voters","Appointed in the apex of the civil rights era, Damon Keith gave his own court a haunting reminder of a history he knows well.",POLITICS
Friends Nancy And Sara Lost Nearly 400 Pounds Together,"How We Gained It: Sara: I struggled with my weight my entire life, even as a child. My parents went through a divorce, and",WELLNESS
Making An America Worthy Of The Dreamers' Dreams,"Being ""great"" means honoring our national promises.",POLITICS
Sacred Sisterhood of Healers!,nan,WELLNESS
Jan. 6 Committee Seeks Interview With GOP Rep. Jim Jordan,It's the second time this week the committee publicly sought to interview a sitting member of Congress.,POLITICS
Are You Hard-Wired To Boil Over From Stress?,"Nobody wants to be that hothead who flies off the handle in the face of some everyday annoyance, causing others to roll their",WELLNESS
6 Healthy Carbs To Keep In Your Diet,"I've never been a fan of low-carb diets: Our bodies and our brains need carbohydrates to work effectively. Of course, not all carbohydrates are created equal. Here are six ""great"" carbs to keep in your diet.",HEALTHY LIVING
Finding Brown Fat In MRIs Is A Big Step For Obesity Research,A digitally-enhanced axial MRI of the upper chest (as if viewed from the feet). Areas of potential brown fat are shown in,HEALTHY LIVING
Doctor's Office Etiquette: While You Wait,We all know that doctors are often unable to meet their appointment times. The waiting room is called that for a reason. But you can make the wait more pleasant for yourself and others by following a few guidelines.,WELLNESS
"Laura Ingraham Feared More Violence After Jan. 6, Newly Released Text Message Shows",The Fox News personality messaged then-White House chief of staff Mark Meadows with some advice for Donald Trump a week after the insurrection.,POLITICS
Hurricane Harvey And The Potential Hypocrisy Of Texas Republicans,They opposed aid for victims of Hurricane Sandy. Now that it's their state in need...,POLITICS
Grimes Shocked By Faulty Stage Equipment During Performance In Dublin,But she's OK!,ENTERTAINMENT
Burnout's Silver Lining,"Had it not been for a move across the globe, I may not have made the changes that saved me from being consumed by my job and unhealthy lifestyle. Many of us need a slap upside the head in order to change. Otherwise we'd keep pushing forward in a steady state of burnout.",WELLNESS
Crisis Point,"When Republican Senator Trent Lott and Democrat Senator Tom Daschle, who have been on the opposite sides of the isle on almost every policy and law debated in the Senate, come together to write a book because they both agree we are at a crisis point, it is time to listen.",POLITICS
"A-Sides with Jon Chattman:""Breathe"" in You Me At Six","Josh Franceschi, Max Helyer, Chris Miller, Dan Flint, and Matt Barnes have had quite a run lately all over the globe. Their substantive single ""Room to Breathe"" is in the top 10 on rock radio, and they sold out Wembley Arena right out of the gate.",ENTERTAINMENT
What's In a Name: What Should Patients and Doctors Call Each Other?,"The doctor/patient relationship is highly personal and complex. The physician must maintain a professional rapport and the patient's dignity, respect the person's privacy, and convey an impression of competence.",HEALTHY LIVING
5 Tips For Hiring A New Year's Eve Babysitter (It's Not Too Late!),"Congratulations -- you not only made it through 2012, you were wise enough to make plans (child-free ones at that) to ring",PARENTING
White House To Tweak Birth Control Coverage Rule,nan,POLITICS
72 Hours in Dubai,"Dubai may be known for skyscrapers, shopping and fine dining, but there is a little something for everyone.",TRAVEL
"Kasich, FitzGerald Win Party Nominations",nan,POLITICS
5 Reasons We Love Jennifer Lawrence,"Another year older, another year amazing.",ENTERTAINMENT
Great Expectations = Great Disappointments,There are two sides to expectations. We have to manage our own expectations and we have to be aware of others' expectations of us. Disappointment is a two-way street.,WELLNESS
Germany's Summer Festivals,"August in Germany -- Frankfurt, Bad Nauheim and Kassel to be precise -- is a propitious, tourist-perfect time.",TRAVEL
You'll Never Guess Who Jennifer Lawrence Has A Crush On,Jennifer Lawrence is full of surprises — and few fans could've predicted the immensely likable actress's crush on curmudgeonly,ENTERTAINMENT
